{
  "$schema": "schema/coverage.schema.json",
  "schema_version": "1.0",
  "updated_at": "2026-09-08T15:03:01+08:00",
  "scope": {
    "boundary": "JAX and Pallas entry functions through Jaxpr, StableHLO/Shardy, XLA, PJRT, libtpu, TPU-specific LLO, runtime and target hardware; downstream framework internals are excluded after their JAX boundary is recorded.",
    "coverage_unit": "A reachable workload feature or stack layer with an explicit depth, evidence references and an unobserved, covered, blocked or not-applicable state.",
    "covered_semantics": "covered means that non-zero evidence exists at achieved_depth; it does not mean that target_depth or the whole project is complete.",
    "completion_rule": "After workload census assigns reviewed target depths, every applicable entry must be covered with achieved_depth greater than or equal to target_depth; critical vertical slices target L5, every other reachable branch targets at least L1, no applicable entry remains unobserved or blocked, and every not-applicable rationale is reviewed."
  },
  "layers": [
    {
      "id": "jax-python-program-model",
      "title": "JAX Python values, PyTrees, arrays, primitives and effects",
      "status": "covered",
      "target_depth": "L4",
      "achieved_depth": "L1",
      "evidence": {
        "documentation": [
          "docs/architecture/00-whole-stack.md"
        ],
        "topic_refs": [],
        "claim_refs": [],
        "source_refs": [],
        "capture_refs": [],
        "probe_refs": []
      },
      "depends_on": [],
      "notes": [
        "Only the initial public boundary and responsibilities are mapped; the program-model topic and labs are not complete."
      ]
    },
    {
      "id": "transformations-jaxpr",
      "title": "Tracing, Jaxpr, jit, AD, batching and transformation composition",
      "status": "covered",
      "target_depth": "L4",
      "achieved_depth": "L1",
      "evidence": {
        "documentation": [
          "docs/architecture/00-whole-stack.md"
        ],
        "topic_refs": [
          "03-jit-cache"
        ],
        "claim_refs": [
          "03-jit-cache#shape-retrace"
        ],
        "source_refs": [
          "03-jit-cache#jax.pjit.trace-for-jit"
        ],
        "capture_refs": [
          "docs/contributing/examples/03-jit-cache/captures/jit-cold-call/manifest.json"
        ],
        "probe_refs": [
          "labs/001-jit-cpu/probe.py"
        ]
      },
      "depends_on": [],
      "notes": [
        "The architecture boundary is L1. A VERSION-SKEW CPU cache probe and capture exist, but the entry remains L1 until its claim is joined to real IR and a source caller/callee path; composition and AD remain unobserved."
      ]
    },
    {
      "id": "jax-mlir-stablehlo",
      "title": "Jaxpr lowering, MLIR and StableHLO",
      "status": "covered",
      "target_depth": "L4",
      "achieved_depth": "L1",
      "evidence": {
        "documentation": [
          "docs/architecture/00-whole-stack.md",
          "docs/architecture/01-regular-xla-tpu-path.md"
        ],
        "topic_refs": [],
        "claim_refs": [],
        "source_refs": [],
        "capture_refs": [],
        "probe_refs": []
      },
      "depends_on": [
        "transformations-jaxpr"
      ],
      "notes": [
        "Public interfaces are mapped; no topic-local lowering capture is recorded yet."
      ]
    },
    {
      "id": "shardy-xla-hlo",
      "title": "Conditional Shardy path and XLA HLO pipelines",
      "status": "covered",
      "target_depth": "L5",
      "achieved_depth": "L1",
      "evidence": {
        "documentation": [
          "docs/architecture/00-whole-stack.md",
          "docs/architecture/01-regular-xla-tpu-path.md"
        ],
        "topic_refs": [],
        "claim_refs": [],
        "source_refs": [],
        "capture_refs": [],
        "probe_refs": []
      },
      "depends_on": [
        "jax-mlir-stablehlo"
      ],
      "notes": [
        "The public source boundary is mapped. Shardy is conditional and TPU HLO pass execution is not yet observed."
      ]
    },
    {
      "id": "ifrt-pjrt-jaxlib",
      "title": "jaxlib bindings, IFRT/PJRT compile and execution control",
      "status": "covered",
      "target_depth": "L4",
      "achieved_depth": "L1",
      "evidence": {
        "documentation": [
          "docs/architecture/00-whole-stack.md",
          "docs/architecture/01-regular-xla-tpu-path.md",
          "docs/architecture/03-runtime-control-plane.md"
        ],
        "topic_refs": [],
        "claim_refs": [],
        "source_refs": [],
        "capture_refs": [],
        "probe_refs": []
      },
      "depends_on": [
        "jax-mlir-stablehlo"
      ],
      "notes": [
        "Only public bindings, loader and ABI seams are mapped; object lifetimes and dispatch remain unobserved."
      ]
    },
    {
      "id": "pallas-mosaic-tpu",
      "title": "Pallas kernel Jaxpr, Mosaic TPU MLIR and outer custom call",
      "status": "covered",
      "target_depth": "L5",
      "achieved_depth": "L1",
      "evidence": {
        "documentation": [
          "docs/architecture/00-whole-stack.md",
          "docs/architecture/02-pallas-mosaic-tpu-path.md"
        ],
        "topic_refs": [],
        "claim_refs": [],
        "source_refs": [],
        "capture_refs": [],
        "probe_refs": []
      },
      "depends_on": [
        "transformations-jaxpr"
      ],
      "notes": [
        "The two-level payload boundary is mapped from public source; no local Mosaic fixture or interpreter capture is recorded."
      ]
    },
    {
      "id": "libtpu-compiler",
      "title": "libtpu compiler internals for regular HLO and Mosaic payloads",
      "status": "blocked",
      "target_depth": "L5",
      "evidence": {
        "documentation": [
          "docs/architecture/00-whole-stack.md"
        ],
        "topic_refs": [],
        "claim_refs": [],
        "source_refs": [],
        "capture_refs": [],
        "probe_refs": []
      },
      "depends_on": [
        "shardy-xla-hlo",
        "pallas-mosaic-tpu"
      ],
      "blockers": [
        "No matching libtpu source, binary build ID or build toolchain is present."
      ],
      "next_action": "Lock the matching libtpu source and binary provenance, then inventory its compiler entry points and pass registry.",
      "notes": [
        "The current architecture drawing records only an assumed private boundary, not compiler internals."
      ]
    },
    {
      "id": "tpu-runtime-control-plane",
      "title": "libtpu runtime, executable loading, launch, buffers, events and driver boundary",
      "status": "blocked",
      "target_depth": "L5",
      "evidence": {
        "documentation": [
          "docs/architecture/00-whole-stack.md",
          "docs/architecture/03-runtime-control-plane.md"
        ],
        "topic_refs": [],
        "claim_refs": [],
        "source_refs": [],
        "capture_refs": [],
        "probe_refs": []
      },
      "depends_on": [
        "ifrt-pjrt-jaxlib",
        "libtpu-compiler"
      ],
      "blockers": [
        "No matching libtpu runtime source is present and no TPU device is available."
      ],
      "next_action": "After libtpu intake, map compile/load/execute APIs separately; add RUN-TPU launch and lifecycle captures when a device is available.",
      "notes": [
        "Generic CPU PJRT work can proceed independently but cannot establish TPU runtime behavior."
      ]
    },
    {
      "id": "llo-machine-bundle",
      "title": "Target-specific LLO, scheduling and machine bundle",
      "status": "blocked",
      "target_depth": "L5",
      "evidence": {
        "documentation": [
          "docs/architecture/00-whole-stack.md"
        ],
        "topic_refs": [],
        "claim_refs": [],
        "source_refs": [],
        "capture_refs": [],
        "probe_refs": []
      },
      "depends_on": [
        "libtpu-compiler"
      ],
      "blockers": [
        "The libtpu source and target TPU generation are not fixed; no LLO schema or fixture is available."
      ],
      "next_action": "Fix a target generation and compiler build, then enumerate the actual LLO schema, passes, address spaces and bundle encoding.",
      "notes": [
        "No specific opcode, VLIW structure or machine encoding is currently claimed."
      ]
    },
    {
      "id": "tpu-hardware-execution",
      "title": "Target TPU memory, execution resources, interconnect and counters",
      "status": "blocked",
      "target_depth": "L5",
      "evidence": {
        "documentation": [
          "docs/architecture/00-whole-stack.md"
        ],
        "topic_refs": [],
        "claim_refs": [],
        "source_refs": [],
        "capture_refs": [],
        "probe_refs": []
      },
      "depends_on": [
        "tpu-runtime-control-plane",
        "llo-machine-bundle"
      ],
      "blockers": [
        "No TPU generation, topology, runtime/firmware revision or device access is fixed."
      ],
      "next_action": "Lock a TPU target manifest and collect RUN-TPU profiles that connect LLO groups to the target's documented resources.",
      "notes": [
        "Hardware resource names remain target-dependent until that intake is complete."
      ]
    }
  ],
  "features": [
    {
      "id": "public-architecture-skeleton",
      "title": "Initial public-boundary architecture skeleton",
      "status": "covered",
      "target_depth": "L1",
      "achieved_depth": "L1",
      "evidence": {
        "documentation": [
          "docs/architecture/00-whole-stack.md",
          "docs/architecture/01-regular-xla-tpu-path.md",
          "docs/architecture/02-pallas-mosaic-tpu-path.md",
          "docs/architecture/03-runtime-control-plane.md"
        ],
        "topic_refs": [],
        "claim_refs": [],
        "source_refs": [],
        "capture_refs": [],
        "probe_refs": []
      },
      "depends_on": [],
      "notes": [